{
  "page_id": "pg_01J00000000000000000000000",
  "source_version_id": "ver_01J00000000000000000000000",
  "page_number": 3,
  "image_path": ".knowledge-compiler/pages/pg_01J00000000000000000000000.png",
  "text": "A Markov chain has the Markov property.",
  "text_status": "reviewed",
  "language": "en"
}

